{
  "schemaVersion": "agentropolis.spatial-contract.v1",
  "spatialRuntimeContract": "agentropolis.spatial-runtime.v1",
  "worldVersion": 4,
  "districts": [
    {
      "id": "axis",
      "name": "Axis / Mission Control",
      "parcel": {
        "x": 0,
        "z": 0,
        "width": 9,
        "depth": 9
      },
      "buildings": [
        {
          "buildingId": "mission-control-hq",
          "localOffset": {
            "x": 0,
            "y": 0,
            "z": 0
          },
          "floors": [
            {
              "floorIndex": 0,
              "offices": [
                {
                  "officeId": "lobby",
                  "label": "Lobby"
                }
              ]
            }
          ]
        }
      ]
    },
    {
      "id": "hermes-city",
      "name": "HERMES CITY",
      "parcel": {
        "x": 0,
        "z": 29,
        "width": 12,
        "depth": 9
      }
    }
  ]
}
